No backup commands to pass to shell script.,Δεν υπάρχουν εντολές αντιγράφου ασφαλείας για να περάσουν στο shell script.
Couldn't save backup results details in database.,Δεν ήταν δυνατή η αποθήκευση λεπτομερειών αποτελεσμάτων αντιγράφου ασφαλείας στη βάση δεδομένων.
Error obtaining run rule finish background command.,Σφάλμα κατά τη λήψη της εντολής ολοκλήρωσης κανόνα εκτέλεσης.
Error creating backup shell script.,Σφάλμα κατά τη δημιουργία του shell script αντιγράφου ασφαλείας.
Couldn't obtain required resources.,Αδυναμία λήψης των απαιτούμενων πόρων.
Error launching backup result shell script.,Σφάλμα κατά την εκκίνηση του shell script αποτελέσματος αντιγράφου ασφαλείας.
Couldn't unlink days for backup rule.,Αδυναμία αποσύνδεσης ημερών για τον κανόνα αντιγραφής ασφαλείας.
Error obtaining FTP credentials.,Σφάλμα κατά τη λήψη των διαπιστευτηρίων FTP.
No days provided to link to backup rule.,Δεν παρέχονται ημέρες για σύνδεση με τον κανόνα αντιγράφου ασφαλείας.
Error un-linking days for backup rule.,Σφάλμα στην αποσύνδεση των ημερών για τον κανόνα αντιγραφής ασφαλείας.
Error linking days to backup rule.,Σφάλμα σύνδεσης ημερών με κανόνα αντιγράφων ασφαλείας.
Couldn't create backup location for provided rule.,Αδυναμία δημιουργίας τοποθεσίας αντιγράφου ασφαλείας για τον καθορισμένο κανόνα.
Backup location directory is not writable.,Ο κατάλογος τοποθεσίας αντιγράφου ασφαλείας δεν είναι εγγράψιμος.
Error creating rule directory in backup location directory.,Σφάλμα δημιουργίας καταλόγου κανόνα στον κατάλογο τοποθεσίας αντιγράφου ασφαλείας.
Please provide a result ID.,Παρακαλώ δώστε ένα αναγνωριστικό αποτελέσματος.
Please provide full script file name.,Παρακαλώ δώστε το πλήρες όνομα του αρχείου σεναρίου.
Commands array provided is empty.,Ο παρεχόμενος πίνακας εντολών είναι κενός.
Couldn't write to backup shell script.,Αδυναμία εγγραφής στο αντίγραφο ασφαλείας του shell script.
Couldn't write commands to backup shell script.,Δεν μπόρεσε να γράψει εντολές για το αντίγραφο ασφαλείας του shell script.
Please provide a rule title.,Παρακαλώ δώστε έναν τίτλο κανόνα.
Please provide a copy result action.,Παρακαλώ παρέχετε μια ενέργεια αντιγραφής αποτελέσματος.
Invalid FTP settings.,Μη έγκυρες ρυθμίσεις FTP.
Error encoding FTP credentials. Please try again.,Σφάλμα κωδικοποίησης διαπιστευτηρίων FTP. Παρακαλώ προσπαθήστε ξανά.
Provided backup location is not a directory.,Η παρεχόμενη τοποθεσία αντιγράφου ασφαλείας δεν είναι φάκελος.
Provided backup location is not writable.,Η παρεχόμενη τοποθεσία αντιγράφου ασφαλείας δεν είναι εγγράψιμη.
Please provide a valid backup hour.,Παρακαλώ δώστε μια έγκυρη ώρα αντιγράφου ασφαλείας.
Please provide a valid result delition interval.,Παρακαλώ παρέχετε ένα έγκυρο διάστημα διαγραφής αποτελέσματος.
Please provide backup rule days.,Παρακαλώ παράσχετε τις ημέρες κανόνα αντιγράφου ασφαλείας.
Please provide backup targets.,Παρακαλώ παρέχετε στόχους αντιγράφου ασφαλείας.
Please provide valid status for backup rule.,Παρακαλώ παρέχετε έγκυρη κατάσταση για τον κανόνα αντιγραφής ασφαλείας.
Provided backup location couldn't be checked.,Η τοποθεσία αντιγράφου ασφαλείας που παρέχεται δεν μπορούσε να ελεγχθεί.
Please provide a backup rule id.,Παρακαλώ δώστε ένα αναγνωριστικό κανόνα αντιγράφου ασφαλείας.
Please provide a valid day for backup rule.,Παρακαλώ δώστε έναν έγκυρο κανόνα για αντίγραφο ασφαλείας ημέρας.
Suspended,Ανασταλμένο
Log file,Αρχείο καταγραφής
Result file,Αρχείο αποτελέσματος
Backup result details not found in database.,Λεπτομέρειες αποτελέσματος αντιγράφου ασφαλείας δεν βρέθηκαν στη βάση δεδομένων.
Backup result run directory not set.,Το αποτέλεσμα αντιγραφής ασφαλείας του καταλόγου εκτέλεσης δεν έχει οριστεί.
Backup result is not pending execution.,Το αποτέλεσμα αντιγράφου ασφαλείας δεν είναι σε εκκρεμή εκτέλεση.
Backup result is not running.,Το αποτέλεσμα αντιγράφου ασφαλείας δεν εκτελείται.
Error updating backup result files sizes.,Σφάλμα κατά την ενημέρωση των μεγεθών αρχείων αποτελεσμάτων αντιγράφου ασφαλείας.
Cannot obtain backup result files from database.,Αδυναμία λήψης αρχείων αποτελεσμάτων αντιγράφου ασφαλείας από τη βάση δεδομένων.
Error updating backup result size.,Σφάλμα κατά την ενημέρωση του μεγέθους αποτελέσματος αντιγράφου ασφαλείας.
Error updating backup result files size.,Σφάλμα κατά την ενημέρωση του μεγέθους των αρχείων αποτελεσμάτων αντιγράφου ασφαλείας.
Couldn't unlink result files from result.,Αδυναμία αποσύνδεσης αρχείων αποτελέσματος από το αποτέλεσμα.
Error updating result details from database.,Σφάλμα κατά την ενημέρωση των λεπτομερειών αποτελέσματος από τη βάση δεδομένων.
Error deleting result file.,Σφάλμα κατά τη διαγραφή του αρχείου αποτελέσματος.
No files provided to link to backup result.,Δεν παρέχονται αρχεία για σύνδεση με το αποτέλεσμα αντιγράφου ασφαλείας.
Error un-linking result files from backup result.,Σφάλμα στην αποσύνδεση των αρχείων αποτελέσματος από το αντίγραφο ασφαλείας αποτελέσματος.
Error inserting result file in database.,Σφάλμα κατά την εισαγωγή του αρχείου αποτελεσμάτων στη βάση δεδομένων.
Error editing result file in database.,Σφάλμα επεξεργασίας αρχείου αποτελέσματος στη βάση δεδομένων.
Please provide running backup rule directory.,Παρακαλώ παράσχετε τον κανόνα εκτέλεσης αντιγράφου ασφαλείας του φακέλου.
Please provide backup result rule.,Παρακαλώ παρέχετε τον κανόνα αποτελέσματος αντιγράφου ασφαλείας.
Error linking result files to backup result.,Σφάλμα σύνδεσης αρχείων αποτελεσμάτων με αντίγραφο ασφαλείας αποτελέσματος.
Please provide a backup result id for result file.,Παρακαλώ παρέχετε ένα αναγνωριστικό αντιγράφου ασφαλείας για το αρχείο αποτελέσματος.
Please provide a backup result file.,Παρακαλώ παρέχετε ένα αρχείο αποτελεσμάτων αντιγράφου ασφαλείας.
Please provide a backup result file target id.,Παρακαλώ παράσχετε έναν στόχο αρχείου αποτελέσματος αντιγράφου ασφαλείας.
Please provide a backup result file type.,Παρακαλώ παρέχετε έναν τύπο αρχείου αποτελέσματος αντιγράφου ασφαλείας.
