# !!!!! DON'T EDIT THIS COLUMN AT ALL !!!!!,TEXT IN THIS COLUMN SHOULD BE TRANSLATED IN DESIRED LANGUAGE
# Please use Excel (or similar) as editor for this file to be sure formatting will not be broken!!!,
# Lines starting with # will be ignored.,Column separator is comma!! (configure Excel or similar to use comma)
Couldn't load template from plugin settings.,Impossibile caricare il modello dalle impostazioni del plugin.
Error rendering template [%s].,Errore nella traduzione del modello [%s].
Failed validating notifications template file.,Impossibile convalidare le notifiche del file modello.
